{
  "$schema": "./content.schema.json",
  "schemaVersion": 1,
  "metadata": {
    "title": "Tempo — Catàleg historiogràfic",
    "language": "ca",
    "lastReviewed": "2026-07-19",
    "editorialNote": "Primera entrega profunda: món antic i medieval. L'estructura segueix l'índex de Burkholder, Grout i Palisca; el manual del CPM Francisco Guerrero serveix de contrast pedagògic. Les reconstruccions sonores de repertoris antics s'identifiquen com a interpretacions modernes, no com a documents sonors del passat."
  },
  "parts": [
    {
      "id": "part-ancient-medieval",
      "order": 1,
      "title": "Els mons antic i medieval",
      "subtitle": "De l'empremta arqueològica a la polifonia escrita",
      "dates": "c. 3000 aC–c. 1400",
      "thesis": "La història musical anterior a 1400 no és un preludi rudimentari de la tonalitat moderna, sinó un mosaic de pràctiques rituals, cortesanes, urbanes i pedagògiques. La possibilitat de conèixer-les depèn dels rastres que han sobreviscut: instruments, imatges, textos, tractats i notacions. Entre el món antic i la baixa edat mitjana canvien profundament les institucions, els sistemes d'escriptura, la relació entre paraula i so i la idea mateixa d'autoria.",
      "chapterIds": [
        "chapter-01-antiquity",
        "chapter-02-early-church",
        "chapter-03-roman-liturgy",
        "chapter-04-medieval-song-dance",
        "chapter-05-thirteenth-century-polyphony",
        "chapter-06-fourteenth-century-france-italy"
      ],
      "sourceRefs": [
        {"sourceId": "burkholder-grout-palisca-2019", "pages": "23–192"},
        {"sourceId": "cpm-francisco-guerrero-2014", "pages": "15–58"}
      ]
    }
  ],
  "chapters": [
    {
      "id": "chapter-01-antiquity",
      "partId": "part-ancient-medieval",
      "order": 1,
      "title": "La música a l'Antiguitat",
      "subtitle": "Rastre, pensament i reconstrucció",
      "dates": "c. 3000 aC–segle V",
      "synopsis": "Coneixem la música antiga de manera fragmentària: l'arqueologia conserva instruments i espais; la iconografia mostra gestos i conjunts; la literatura descriu usos i idees; la notació permet reconstruir només una part ínfima del que va sonar. Mesopotàmia aporta testimonis molt antics d'escriptura musical, mentre que Grècia llegà un cos especialment influent de teoria i filosofia. Cal distingir sempre la continuïtat de les idees gregues de la continuïtat efectiva de les seves pràctiques sonores.",
      "sectionIds": ["section-ancient-evidence", "section-greek-system", "section-music-thought"],
      "personIds": ["pythagoras", "plato"],
      "workIds": ["seikilos-epitaph"],
      "conceptIds": ["historical-evidence", "monody", "ethos", "tetrachord"],
      "sourceRefs": [
        {"sourceId": "burkholder-grout-palisca-2019", "pages": "23–44"},
        {"sourceId": "cpm-francisco-guerrero-2014", "pages": "15–22"}
      ]
    },
    {
      "id": "chapter-02-early-church",
      "partId": "part-ancient-medieval",
      "order": 2,
      "title": "L'Església cristiana en el primer mil·lenni",
      "subtitle": "Ritu, memòria i unificació",
      "dates": "segles I–X",
      "synopsis": "El cant cristià nasqué dins una xarxa de comunitats amb herències jueves, llengües i ritus diversos. Abans de la uniformització romana coexistiren repertoris locals —romà antic, ambrosià, mossàrab, gal·licà i altres— transmesos principalment de memòria. La consolidació del cant que anomenem gregorià fou un procés polític, litúrgic i pedagògic de llarga durada, no la creació sobtada d'un únic autor. L'escriptura neumàtica va ajudar a estabilitzar repertoris que continuaven depenent de l'aprenentatge oral.",
      "sectionIds": ["section-christian-roots", "section-chant-dialects", "section-memory-writing"],
      "personIds": ["boethius", "gregory-the-great"],
      "workIds": [],
      "conceptIds": ["chant-dialect", "oral-transmission", "neume"],
      "sourceRefs": [
        {"sourceId": "burkholder-grout-palisca-2019", "pages": "45–74"},
        {"sourceId": "cpm-francisco-guerrero-2014", "pages": "23–27"}
      ]
    },
    {
      "id": "chapter-03-roman-liturgy",
      "partId": "part-ancient-medieval",
      "order": 3,
      "title": "La litúrgia romana i el cant pla",
      "subtitle": "Organitzar l'any, el ritu i la memòria",
      "dates": "segles VIII–XII",
      "synopsis": "El cant pla adquireix sentit dins la litúrgia: la missa i l'ofici ordenen textos, funcions, dies i comunitats. Antífones, responsoris, salmòdia i cants de l'ordinari o del propi no són peces intercanviables, sinó formes associades a moments rituals concrets. Modes, fórmules melòdiques i notació faciliten la classificació i la transmissió. Trops, seqüències i drames litúrgics mostren que la tradició no era immòbil; Hildegarda de Bingen n'expandeix l'abast poètic i melòdic des d'una comunitat femenina.",
      "sectionIds": ["section-mass-office", "section-mode-notation", "section-chant-expansions"],
      "personIds": ["guido-arezzo", "hildegard-bingen"],
      "workIds": ["puer-natus-est", "ut-queant-laxis", "o-vis-aeternitatis"],
      "conceptIds": ["mode", "neume", "trope", "sequence"],
      "sourceRefs": [
        {"sourceId": "burkholder-grout-palisca-2019", "pages": "75–100"},
        {"sourceId": "cpm-francisco-guerrero-2014", "pages": "27–34"}
      ]
    },
    {
      "id": "chapter-04-medieval-song-dance",
      "partId": "part-ancient-medieval",
      "order": 4,
      "title": "La cançó i la música de dansa a l'edat mitjana",
      "subtitle": "Corts, ciutats, peregrinacions i cossos",
      "dates": "c. 1050–c. 1400",
      "synopsis": "Fora del marc litúrgic, la monodia medieval circulà per corts, places, rutes de peregrinació i territoris lingüístics molt diferents. Trobadors i trouvères elaboraren codis poètics de desig, servei i prestigi, mentre que les Cantigas de Santa Maria vincularen devoció, relat miraculós i projecte cortesà. La notació conserva sobretot l'esquelet melòdic: instrumentació, tempo i ornamentació exigeixen decisions interpretatives. Les danses instrumentals recorden que gran part de la vida musical medieval no quedà fixada per escrit.",
      "sectionIds": ["section-andalusian-song", "section-troubadour-courts", "section-iberian-song-dance"],
      "personIds": ["bernart-ventadorn", "alfonso-x"],
      "workIds": ["can-vei-lauzeta", "santa-maria-strela", "lamento-tristano"],
      "conceptIds": ["courtly-love", "virelai", "estampie"],
      "sourceRefs": [
        {"sourceId": "burkholder-grout-palisca-2019", "pages": "101–120"},
        {"sourceId": "cpm-francisco-guerrero-2014", "pages": "35–48"}
      ]
    },
    {
      "id": "chapter-05-thirteenth-century-polyphony",
      "partId": "part-ancient-medieval",
      "order": 5,
      "title": "La polifonia al llarg del segle XIII",
      "subtitle": "Mesurar el temps i construir l'espai sonor",
      "dates": "c. 900–c. 1300",
      "synopsis": "La polifonia escrita sorgeix com una manera d'amplificar i recrear el cant, no de substituir-lo. De l'organum paral·lel a les textures florides aquitanes i a les grans elaboracions de Notre-Dame, la coordinació de veus obliga a imaginar noves formes de mesurar i notar el temps. Els modes rítmics fan possible una arquitectura sonora de gran escala; el motet reutilitza fragments litúrgics i hi superposa textos nous, fins i tot en llengües diferents. La catedral és alhora espai ritual, institució educativa i símbol urbà.",
      "sectionIds": ["section-early-organum", "section-notre-dame", "section-motet-thirteenth"],
      "personIds": ["leonin", "perotin"],
      "workIds": ["viderunt-omnes"],
      "conceptIds": ["organum", "rhythmic-modes", "motet"],
      "sourceRefs": [
        {"sourceId": "burkholder-grout-palisca-2019", "pages": "121–156"},
        {"sourceId": "cpm-francisco-guerrero-2014", "pages": "49–54"}
      ]
    },
    {
      "id": "chapter-06-fourteenth-century-france-italy",
      "partId": "part-ancient-medieval",
      "order": 6,
      "title": "La música francesa i italiana al segle XIV",
      "subtitle": "Ars Nova, formes fixes i subtilesa",
      "dates": "c. 1300–c. 1400",
      "synopsis": "Al segle XIV, una notació rítmica més flexible amplia les possibilitats de coordinació, síncope i proporció. A França, l'Ars Nova i la isorítmia donen al motet una estructura de llarg abast; Guillaume de Machaut integra poesia, cançó i polifonia sacra dins un llegat excepcionalment ben conservat. A Itàlia, madrigal, caccia i ballata configuren el Trecento, amb Francesco Landini com a figura central. L'Ars Subtilior porta l'escriptura i la interpretació cortesanes a una complexitat deliberadament exclusiva.",
      "sectionIds": ["section-ars-nova", "section-machaut-forms", "section-trecento-subtilior"],
      "personIds": ["philippe-vitry", "guillaume-machaut", "francesco-landini"],
      "workIds": ["machaut-kyrie", "douce-dame-jolie", "ecco-la-primavera"],
      "conceptIds": ["isorhythm", "formes-fixes", "ars-subtilior"],
      "sourceRefs": [
        {"sourceId": "burkholder-grout-palisca-2019", "pages": "157–192"},
        {"sourceId": "cpm-francisco-guerrero-2014", "pages": "54–58"}
      ]
    }
  ],
  "sections": [
    {
      "id": "section-ancient-evidence",
      "chapterId": "chapter-01-antiquity",
      "order": 1,
      "title": "Com sabem què sonava?",
      "argument": "No hi ha una única font que restitueixi la música antiga. Instruments excavats, escenes pintades, descripcions literàries, tractats i fragments de notació aporten dades diferents i sovint incompletes. Una interpretació actual combina evidències i hipòtesis; per això cal separar allò documentat —un interval, un text, una forma d'instrument— de les decisions modernes sobre timbre, tempo o acompanyament.",
      "context": "Les societats de Mesopotàmia, Egipte, Palestina, Grècia i Roma atribuïren a la música funcions rituals, educatives, teatrals, militars i cortesanes.",